{
  "schema": "umicom.suite/2",
  "id": "umicom.suite.complete",
  "name": "Umicom Complete Suite",
  "status": "active",
  "enabled": true,
  "required_members": [
    "umicom.studio-ide",
    "umicom.tms",
    "umicom.bank",
    "umicom.llm",
    "umicom.umicoin",
    "umicom.authorengine"
  ],
  "optional_members": [
    "umicom.trader",
    "umicom.studio-media",
    "umicom.studio-music",
    "umicom.book",
    "umicom.browser",
    "umicom.commodity-exchange"
  ]
}
