{
  "schema": "umicom.suite/2",
  "id": "umicom.suite.financial",
  "name": "Umicom Financial Suite",
  "status": "active",
  "enabled": true,
  "required_members": [
    "umicom.tms",
    "umicom.bank",
    "umicom.umicoin"
  ],
  "optional_members": [
    "umicom.trader",
    "umicom.commodity-exchange"
  ]
}
